{
  "$schema": "https://raw.githubusercontent.com/chrystyan96/execfence/master/schema/execfence.schema.json",
  "policyPack": "baseline",
  "mode": "block",
  "blockSeverities": ["critical", "high"],
  "warnSeverities": ["medium", "low"],
  "allowExecutables": [
    {
      "path": "tools/reviewed-helper.exe",
      "sha256": "0000000000000000000000000000000000000000000000000000000000000000",
      "reason": "Reviewed build helper pinned by hash."
    }
  ],
  "extraSignatures": ["project-specific-bad-marker"],
  "extraRegexSignatures": ["project-bad-[0-9]+"],
  "signaturesFile": ".execfence/config/signatures.json",
  "baselineFile": ".execfence/config/baseline.json",
  "sandboxFile": ".execfence/config/sandbox.json",
  "reportsDir": ".execfence/reports",
  "reportsGitignore": true,
  "runtimeTrace": {
    "enabled": true,
    "postRunScan": true,
    "captureGitStatus": true,
    "redactEnv": true,
    "snapshotFiles": true,
    "recordArtifacts": false,
    "denyOnNewExecutable": false
  },
  "performance": {
    "scanCache": true,
    "scanCacheMaxEntries": 10000,
    "dependencyConcurrency": 4,
    "maxWorkerMemoryMb": 256
  },
  "analysis": {
    "webEnrichment": {
      "enabled": true,
      "automaticForSeverities": ["critical", "high"],
      "maxQueriesPerFinding": 3,
      "allowedDomains": [],
      "timeoutMs": 4000,
      "cacheTtlMs": 86400000
    }
  },
  "manifest": {
    "path": ".execfence/manifest.json",
    "requireRunWrapper": true,
    "blockNewEntrypoints": true,
    "sensitiveEntrypoints": ["build", "test", "dev", "start", "serve", "watch", "prepare", "install", "postinstall"]
  },
  "ci": {
    "enabled": true,
    "baseRef": "HEAD",
    "checks": ["scan", "manifest-diff", "deps-diff", "coverage", "config-validate", "pack-audit", "trust-audit", "policy-diff", "approval-audit"]
  },
  "wire": {
    "packageScripts": true,
    "workflows": true,
    "makefile": true,
    "vscodeTasks": true
  },
  "deps": {
    "detectRegistryDrift": true,
    "detectSuspiciousSources": true,
    "detectLifecycleEntries": true,
    "detectBinEntries": true,
    "detectTyposquatting": true
  },
  "adopt": {
    "writeSuggestedBaseline": false,
    "blockDuringAdoption": false
  },
  "policy": {
    "customPoliciesDir": ".execfence/config/policies",
    "requiredOwners": {}
  },
  "approvals": {
    "path": ".execfence/approvals.json",
    "approversPath": ".execfence/trust/approvers.json",
    "requireSignedFindings": true,
    "requireSignedManifest": false,
    "requireSignedPolicyChanges": false,
    "minimumSignatures": 1
  },
  "trustStore": {
    "files": ".execfence/trust/files.json",
    "actions": ".execfence/trust/actions.json",
    "registries": ".execfence/trust/registries.json",
    "packageScopes": ".execfence/trust/package-scopes.json",
    "packageSources": ".execfence/trust/package-sources.json"
  },
  "htmlReport": {
    "enabled": true,
    "includeRuntimeTrace": true,
    "includeManifest": true
  },
  "reports": {
    "retention": {
      "maxReports": 100,
      "maxAgeDays": 90
    }
  },
  "redaction": {
    "redactLocalPaths": true,
    "redactEnv": true,
    "extraPatterns": []
  },
  "workflowHardening": true,
  "archiveAudit": true,
  "auditAllPackageScripts": false
}
